1;EUROPE;Vương miện nữ hoàng Elizabeth;0;100000;Đội che nắng bao phê;NOTSOLD
2;ASIA;Quần đùi Tần Thủy Hoàng;3;25000;Mặc bao mát;SOLD
3;ASIA;Máy massage cầm tay thời đồ đá;2;50000;Thoải mái tinh thần thư giản gân cốt;SOLD
4;AFRICA;Tượng thầy tu Kaaper;1;30000;Tượng 4.500 năm tuổi của một vị thầy tu Ai Cập;SOLD
5;AFRICA;Bình rượu Ai Cập bằng bạc;2;2500;Chiếc bình bằng bạc có vào khoảng TK 1 TCN;SOLD
6;EUROPE;Hoa tai Hy Lạp;2;1000;Đôi hoa tai bằng vàng thời Hy Lạp cổ năm 300 TCN.;SOLD
7;AFRICA;Tượng mèo Ai Cập;1;49999;Tượng mèo có niên đại khoảng năm 332 TCN;SOLD
8;EUROPE;Vòng tay Byzantium;2;30000;Vòng tay bằng vàng thời Byzantium năm 400 TCN.;SOLD
